<?xml version="1.0" encoding="UTF-8"?>
<rutas xmlns="https://www.uniovi.es"
       xmlns:xsi="http://www.w3.org/2001/XMLSchema-instance"
       xsi:schemaLocation="https://www.uniovi.es rutas.xsd">
    <!-- ============================ RUTA 1 - Foz de Lumbier ================================ -->
    <ruta>
        <nombre>Ruta de la Foz de Lumbier, Ermita de Piedra y Arcos de Piedra</nombre>
        <tipo>Paisajística</tipo>
        <transporte>A pie</transporte>
        <fechaInicio>2026-07-15</fechaInicio>
        <horaInicio>08:30:00</horaInicio>
        <duracion>6 horas 16 minutos</duracion>
        <agencia>Sin agencia</agencia>
        <descripcion>Caminata circular de un día partiendo desde el poblado de Lumbier. Se recorren los principales puntos de interés. No habría problemas en avanzar para gente acostumbrada a este tipo de senderos.</descripcion>
        <personas>Personas en buena forma física</personas>

        <inicio>
            <lugar>Hotel Iru - Bide</lugar>
            <direccion>Av. de Bijues, s/n</direccion>
            <coordenadas>
                <longitud>-1.310790</longitud>
                <latitud>42.650934</latitud>
                <altitud unidad="m">429</altitud>
            </coordenadas>
        </inicio>

        <referencias>
            <referencia>https://www.visitnavarra.es/es/foz-de-lumbier</referencia>
            <referencia>https://es.wikiloc.com/rutas-senderismo/navarra-foz-de-lumbier-ermita-de-la-trinidad-arcos-de-piedra-trek-1d-175574249</referencia>
            <referencia>https://lumbier.com/la-foz-de-lumbier/</referencia>
        </referencias>

        <recomendacion>7</recomendacion>

        <hitos>

            <hito>
                <coordenadas>
                    <longitud>-1.311253</longitud>
                    <latitud>42.650330</latitud>
                    <altitud unidad="m">428.7</altitud>
                </coordenadas>
                <distancia unidades="m">77</distancia>
            </hito>

            <hito>
                <nombre>Puente de los hierros</nombre>
                <descripcion>Puente de hierro sobre el rio Irati, vestigio de la antigua via ferrea del Irati reconvertida en sendero peatonal. Desde el puente se obtienen las primeras vistas de las paredes calizas del desfiladero.</descripcion>
                <coordenadas>
                    <longitud>-1.310352</longitud>
                    <latitud>42.648980</latitud>
                    <altitud unidad="m">427.2</altitud>
                </coordenadas>
                <distancia unidades="m">167</distancia>
                <fotos>
                    <foto>multimedia/imagenes/RUTA1_HITO1_puente_hierros.jpg</foto>
                </fotos>
            </hito>

            <hito>
                <coordenadas>
                    <longitud>-1.309445</longitud>
                    <latitud>42.648308</latitud>
                    <altitud unidad="m">425.3</altitud>
                </coordenadas>
                <distancia unidades="m">105</distancia>
            </hito>

            <hito>
                <coordenadas>
                    <longitud>-1.308312</longitud>
                    <latitud>42.649823</latitud>
                    <altitud unidad="m">421.9</altitud>
                </coordenadas>
                <distancia unidades="m">192</distancia>
            </hito>

            <hito>
                <coordenadas>
                    <longitud>-1.307206</longitud>
                    <latitud>42.650296</latitud>
                    <altitud unidad="m">424.9</altitud>
                </coordenadas>
                <distancia unidades="m">105</distancia>
            </hito>

            <hito>
                <coordenadas>
                    <longitud>-1.304371</longitud>
                    <latitud>42.650245</latitud>
                    <altitud unidad="m">438.7</altitud>
                </coordenadas>
                <distancia unidades="m">232</distancia>
            </hito>

            <hito>
                <coordenadas>
                    <longitud>-1.302320</longitud>
                    <latitud>42.651276</latitud>
                    <altitud unidad="m">434.3</altitud>
                </coordenadas>
                <distancia unidades="m">203</distancia>
            </hito>

            <hito>
                <coordenadas>
                    <longitud>-1.301038</longitud>
                    <latitud>42.651257</latitud>
                    <altitud unidad="m">444.8</altitud>
                </coordenadas>
                <distancia unidades="m">105</distancia>
            </hito>

            <hito>
                <coordenadas>
                    <longitud>-1.302121</longitud>
                    <latitud>42.650108</latitud>
                    <altitud unidad="m">459.9</altitud>
                </coordenadas>
                <distancia unidades="m">155</distancia>
            </hito>

            <hito>
                <coordenadas>
                    <longitud>-1.301280</longitud>
                    <latitud>42.649305</latitud>
                    <altitud unidad="m">475.0</altitud>
                </coordenadas>
                <distancia unidades="m">113</distancia>
            </hito>

            <hito>
                <coordenadas>
                    <longitud>-1.301589</longitud>
                    <latitud>42.648882</latitud>
                    <altitud unidad="m">480.9</altitud>
                </coordenadas>
                <distancia unidades="m">53</distancia>
            </hito>

            <hito>
                <coordenadas>
                    <longitud>-1.299955</longitud>
                    <latitud>42.648273</latitud>
                    <altitud unidad="m">507.1</altitud>
                </coordenadas>
                <distancia unidades="m">150</distancia>
            </hito>

            <hito>
                <coordenadas>
                    <longitud>-1.301080</longitud>
                    <latitud>42.647347</latitud>
                    <altitud unidad="m">522.2</altitud>
                </coordenadas>
                <distancia unidades="m">138</distancia>
            </hito>

            <hito>
                <nombre>Sendero de Cruces V - VIII</nombre>
                <descripcion>Tramo elevado del recorrido en el que se localizan las cruces V a VIII de un antiguo Via Crucis talladas en piedra caliza. Ofrece amplias vistas sobre el valle de Lumbier y los campos de cultivo circundantes.</descripcion>
                <coordenadas>
                    <longitud>-1.300788</longitud>
                    <latitud>42.646967</latitud>
                    <altitud unidad="m">533.1</altitud>
                </coordenadas>
                <distancia unidades="m">49</distancia>
                <fotos>
                    <foto>multimedia/imagenes/RUTA1_HITO2_cruces.jpg</foto>
                </fotos>
            </hito>

            <hito>
                <coordenadas>
                    <longitud>-1.300460</longitud>
                    <latitud>42.645390</latitud>
                    <altitud unidad="m">565.7</altitud>
                </coordenadas>
                <distancia unidades="m">177</distancia>
            </hito>

            <hito>
                <coordenadas>
                    <longitud>-1.297289</longitud>
                    <latitud>42.646011</latitud>
                    <altitud unidad="m">613.2</altitud>
                </coordenadas>
                <distancia unidades="m">268</distancia>
            </hito>

            <hito>
                <coordenadas>
                    <longitud>-1.295943</longitud>
                    <latitud>42.645773</latitud>
                    <altitud unidad="m">635.7</altitud>
                </coordenadas>
                <distancia unidades="m">113</distancia>
            </hito>

            <hito>
                <coordenadas>
                    <longitud>-1.295468</longitud>
                    <latitud>42.644972</latitud>
                    <altitud unidad="m">656.4</altitud>
                </coordenadas>
                <distancia unidades="m">97</distancia>
            </hito>

            <hito>
                <coordenadas>
                    <longitud>-1.296602</longitud>
                    <latitud>42.642923</latitud>
                    <altitud unidad="m">711.4</altitud>
                </coordenadas>
                <distancia unidades="m">246</distancia>
            </hito>

            <hito>
                <nombre>Ermita de la Trinidad</nombre>
                <descripcion>Pequeña ermita dedicada a la Santisima Trinidad, enclavada a 724 m de altitud en una posicion privilegiada sobre el valle. Construccion de piedra caliza integrada en el entorno natural y punto de referencia de las antiguas rutas de peregrinacion de la zona.</descripcion>
                <coordenadas>
                    <longitud>-1.296193</longitud>
                    <latitud>42.642087</latitud>
                    <altitud unidad="m">724.6</altitud>
                </coordenadas>
                <distancia unidades="m">99</distancia>
                <fotos>
                    <foto>multimedia/imagenes/RUTA1_HITO3_ermita.jpg</foto>
                </fotos>
            </hito>

            <hito>
                <coordenadas>
                    <longitud>-1.293884</longitud>
                    <latitud>42.641089</latitud>
                    <altitud unidad="m">767.7</altitud>
                </coordenadas>
                <distancia unidades="m">219</distancia>
            </hito>

            <hito>
                <coordenadas>
                    <longitud>-1.289848</longitud>
                    <latitud>42.640110</latitud>
                    <altitud unidad="m">804.4</altitud>
                </coordenadas>
                <distancia unidades="m">348</distancia>
            </hito>

            <hito>
                <coordenadas>